{
  "schema": "hermes.control/v2",
  "schema_version": 2,
  "id": "control_01ARZ3NDEKTSV4RRFFQ69G5FB1",
  "revision": 1,
  "operation": "task.snooze",
  "target": {
    "type": "task",
    "id": "task_01ARZ3NDEKTSV4RRFFQ69G5FAV"
  },
  "parameters": {
    "not_before": "2026-08-11T05:00:00Z"
  },
  "requested_by": "user:local-owner",
  "created_at": "2026-08-11T03:20:00Z",
  "expires_at": "2026-08-11T03:30:00Z",
  "attestation": {
    "method": "local-bridge",
    "key_id": "local-owner",
    "signature": "test-signature-not-for-production"
  },
  "observed": {
    "state": "pending",
    "applied_at": null,
    "result_event_id": null,
    "error": null
  }
}
